{
  "$schema": "http://json-schema.org/draft-07/schema#",
  "title": "EcoDistillationNote",
  "type": "object",
  "required": ["id", "date", "axis", "headline", "facts", "keywords"],
  "properties": {
    "id": { "type": "string", "description": "YYYYMMDD_axis_seq" },
    "date": { "type": "string", "format": "date" },
    "axis": {
      "type": "string",
      "enum": [
        "geopolitics",
        "polarization",
        "fed_policy",
        "productivity_ai",
        "us_investment",
        "rates_fx",
        "commodities_energy",
        "market_signals"
      ]
    },
    "headline": { "type": "string", "description": "1줄 요약" },
    "facts": {
      "type": "array",
      "items": { "type": "string" },
      "description": "검증된 팩트 (수치/날짜 포함, 출처 명시)"
    },
    "cheon_view": {
      "type": "object",
      "description": "동결(2026-10-05): 신규 노트에는 기록하지 않음. 과거 노트에만 남아 있는 필드 — 제거 여부는 추후 결정",
      "properties": {
        "stance": { "type": "string", "enum": ["동의", "부분동의", "반대", "관망"] },
        "note": { "type": "string", "description": "천의 견해 자유 서술 (초기값: distillation 시점엔 비워두고 리뷰 시 채움)" },
        "status": {
          "type": "string",
          "enum": ["pending", "triaged", "drafted", "approved", "rejected"],
          "description": "파이프라인 단계. distillation 직후 기본값 pending"
        },
        "triage_score": {
          "type": ["number", "null"],
          "minimum": 0,
          "maximum": 9,
          "description": "score-notes.mjs가 룰 기반으로 채움 (top_down+bottom_up+time_series 가중치 합)"
        },
        "axis_tag": {
          "type": ["string", "null"],
          "enum": ["top_down", "bottom_up", "time_series", null],
          "description": "draft-judgment.mjs가 부여. 3축 중 근거 부족한 축이 있으면 null(미분류)"
        },
        "draft_judgment": {
          "type": ["string", "null"],
          "description": "Sub-Agent 1차 판단 초안 — 사람이 아직 검증하지 않은 초안"
        },
        "reviewed_at": {
          "type": ["string", "null"],
          "description": "status가 approved/rejected로 바뀐 시각 (ISO 8601)"
        },
        "reject_reason": {
          "type": ["string", "null"],
          "description": "status=rejected일 때만 사용. 반려 후 폐기, 재작성 루프 없음"
        }
      },
      "required": ["stance", "note"]
    },
    "watchlist": {
      "type": "array",
      "items": { "type": "string" },
      "description": "아직 이슈화 안 된 잠재 리스크"
    },
    "keywords": { "type": "array", "items": { "type": "string" } },
    "linked_axes": {
      "type": "array",
      "items": { "type": "string" },
      "description": "이 노트가 연결되는 다른 축 (예: fed_policy -> rates_fx)"
    },
    "vault_pointer": {
      "type": "string",
      "description": "켜뮤 vault 내 원본 파일 경로 (텍스트 복붙 대신 포인터)"
    },
    "source_url": {
      "type": "string",
      "description": "원문 출처 URL (검증 가능성 확보)"
    }
  }
}
