[
  {
    "id": "20261028_market_signals_01",
    "date": "2026-10-28",
    "axis": "market_signals",
    "headline": "메타(META) 주가, 2026년 10월 3분기 실적 발표 이후 1주일간 약 -10.7% 급락 (10/27 종가 620.19달러)",
    "facts": [
      "메타는 2026년 10월21일 장 마감 후 3분기 실적을 발표했으며, 다음날인 10월22일 주가가 전일 대비 6.98%~7.0% 급락해 648.85달러로 마감했다.",
      "3분기 매출은 전년 대비 26% 증가한 646억 달러로 시장 예상치를 상회했음에도, 2026년 설비투자(CAPEX) 하한선을 기존 1,300억 달러에서 1,350억~1,450억 달러로 상향 조정하고 잉여현금흐름이 분기 기준 마이너스(-21.2억 달러, 경영진 기준)로 전환되면서 주가가 하락했다.",
      "3분기 설비투자액은 349억 달러로 영업활동 현금흐름(327.9억 달러)을 초과했으며, 이는 AI 데이터센터·서버·네트워크 인프라 확충에 집중된 결과다.",
      "CEO 마크 저커버그는 실적 발표에서 AI에 더욱 공격적으로 베팅하겠다고 밝혔고, 회사는 인수·비용 조달에 활용 가능한 신규 비의결권 클래스C 보통주 발행 계획도 함께 공개해 투자자 우려를 키웠다.",
      "영업이익률은 전년동기 40.1%에서 20.1%로 반토막났는데, 이 중 상당 부분은 2026년 8월 다주 법무장관 합의에 따른 99억 달러 규모의 법적 비용 충당 때문으로 설명됐다.",
      "10월22일 메타의 5년물 신용부도스와프(CDS) 스프레드가 사상 최고치를 기록해 투자자들의 신용 우려가 커졌음을 시사했다.",
      "같은 날 알파벳, 아마존, 마이크로소프트 등 대형 기술주도 2.2%~4.6% 하락했으나 메타의 낙폭이 가장 컸으며, 나스닥 종합지수도 2.60% 하락해 6월 이후 최대 낙폭을 기록했다.",
      "10월26일에도 메타 주가는 추가로 1.9% 하락해 630.56달러까지 밀렸고, 거래량은 평소 평균 대비 73% 증가했다.",
      "이번 급변은 지정학적 충격이나 투기적 외부 요인이 아니라, 메타 자체의 3분기 실적 발표와 그에 따른 AI 설비투자 확대·잉여현금흐름 악화·신규 비의결권주 발행이라는 펀더멘털(실적 및 자본배분 정책) 요인에 의한 것으로 다수의 금융 매체(Reuters, Bloomberg, CNBC 등)가 일치되게 보도했다."
    ],
    "keywords": [
      "메타",
      "AI 설비투자",
      "잉여현금흐름",
      "빅테크 실적",
      "비의결권주",
      "CDS 스프레드"
    ],
    "source_url": "https://finance.yahoo.com/quote/META"
  }
]