[
  {
    "id": "20260909_geopolitics_01",
    "date": "2026-09-09",
    "axis": "geopolitics",
    "headline": "미국-폴란드, 40억 달러 규모 대외군사자금조달(FMF) 대출보증 협정 체결, 대폴란드 총 지원 규모 약 200억 달러로 확대",
    "facts": [
      "2026년 9월 9일 폴란드 바르샤바에서 미국과 폴란드가 40억 달러 규모의 Foreign Military Financing(FMF) 대출보증 협정에 서명함",
      "미 군비통제·국제안보 담당 차관 Thomas DiNanno가 미국 정부를 대표해 서명에 참여함",
      "이번 서명으로 미국의 대폴란드 총 지원 규모가 약 200억 달러에 이름",
      "2026년 5월 미국-폴란드 공군 간 상호운용성 강화를 기념하는 F-35 항공기 인도 행사가 있었음",
      "폴란드는 최근 Apache 헬기, Patriot 미사일 시스템, HIMARS, 첨단 레이더 기술, F-35 항공기 등을 도입해 국방 역량을 확장함"
    ],
    "cheon_view": {
      "stance": "관망",
      "note": "",
      "status": "pending",
      "triage_score": null,
      "axis_tag": null,
      "draft_judgment": null,
      "reviewed_at": null,
      "reject_reason": null
    },
    "watchlist": [
      "폴란드의 국방비 증액이 NATO 동유럽 전선 억지력에 미치는 장기적 영향",
      "미 방위산업 수출 확대가 미국 국내 방산 공급망에 미치는 영향"
    ],
    "keywords": [
      "미국-폴란드",
      "FMF",
      "대출보증",
      "NATO",
      "방위산업",
      "F-35"
    ],
    "linked_axes": [
      "us_investment",
      "commodities_energy"
    ],
    "vault_pointer": "",
    "source_url": "https://www.state.gov/releases/office-of-the-spokesperson/2026/09/united-states-and-poland-sign-4-billion-foreign-military-financing-loan-guarantee-bringing-total-u-s-support-to-nearly-20-billion/"
  },
  {
    "id": "20260909_geopolitics_02",
    "date": "2026-09-09",
    "axis": "geopolitics",
    "headline": "미 국무부, 마약 카르텔 연계 부패 혐의로 전직 에콰도르 관리 7명 미국 입국 제한 지정",
    "facts": [
      "미 국무부가 2026년 9월 9일 전직 에콰도르 관리 7명을 Section 7031(c)에 따라 공개 지정",
      "해당 지정으로 7명 및 그 직계가족은 미국 입국이 원칙적으로 제한됨",
      "지정 대상: Pablo Ramírez Erazo(전 교정청장), Wilman Terán Carillo(전 대법원 판사), Ronaldo Xavier Guerrero Cruz(전 사법위원회 형사판사), Pablo Bolívar Muentes Alarcón(전 국회의원), María Fabiola Gallardo Ramia(전 과야스 지방법원장), Johann Marfetán Medina(전 과야스 지방법원 형사판사), Mayra Carolina Salazar Merchán(전 과야스 지방법원 홍보담당관)",
      "해당 인물들은 CJNG, Los Choneros, Los Lobos, Sinaloa Cartel 등 트럼프 행정부가 전년(2025년) 지정한 외국테러조직(FTO)과 연계된 갱단으로부터 뇌물을 받고 사법·선거·공공절차에 개입한 혐의를 받음",
      "법적 근거는 National Security, Department of State, and Related Programs Appropriations Act, 2026(Div. F, P.L. 119-75) Section 7031(c)"
    ],
    "cheon_view": {
      "stance": "관망",
      "note": "",
      "status": "pending",
      "triage_score": null,
      "axis_tag": null,
      "draft_judgment": null,
      "reviewed_at": null,
      "reject_reason": null
    },
    "watchlist": [
      "에콰도르 사법부 부패 확산이 마약 카르텔의 라틴아메리카 사법시스템 침투 심화로 이어질 가능성",
      "미국의 FTO 연계 제재 확대가 중남미 정치권과의 외교 마찰 유발 가능성"
    ],
    "keywords": [
      "에콰도르",
      "제재",
      "부패",
      "마약카르텔",
      "외국테러조직",
      "국무부"
    ],
    "linked_axes": [],
    "vault_pointer": "",
    "source_url": "https://www.state.gov/releases/office-of-the-spokesperson/2026/09/designations-of-former-ecuadorian-officials-for-involvement-in-significant-corruption-linked-to-foreign-terrorist-organizations/"
  },
  {
    "id": "20260909_geopolitics_03",
    "date": "2026-09-09",
    "axis": "geopolitics",
    "headline": "미 국무부, 초국가 범죄조직 Xinbi Guarantee 등 3곳 제재 발표",
    "facts": [
      "미 국무부는 2026년 9월 9일 Xinbi Guarantee와 이를 지원한 2개 단체를 제재한다고 발표",
      "제재는 재무부 해외자산통제국(OFAC)이 시행",
      "제재 근거는 행정명령 14390(사이버범죄·사기·약탈적 스킴 대응) 및 행정명령 13581(초국가범죄조직 자산동결, 13863호로 개정)",
      "Xinbi Guarantee는 동남아 스캠센터와 연계된 중국어 기반 온라인 마켓플레이스로 미국인 대상 사이버 사기·자금세탁에 이용됨"
    ],
    "cheon_view": {
      "stance": "관망",
      "note": "",
      "status": "pending",
      "triage_score": null,
      "axis_tag": null,
      "draft_judgment": null,
      "reviewed_at": null,
      "reject_reason": null
    },
    "watchlist": [
      "동남아 스캠센터 네트워크 추가 제재 가능성",
      "중국계 플랫폼 대상 제재 확대에 따른 미중 관계 영향"
    ],
    "keywords": [
      "사이버범죄",
      "제재",
      "OFAC",
      "초국가범죄조직",
      "동남아 스캠센터"
    ],
    "linked_axes": [
      "us_investment"
    ],
    "source_url": "https://www.state.gov/releases/office-of-the-spokesperson/2026/09/dismantling-transnational-criminal-organization-xinbi-guarantee/"
  },
  {
    "id": "20260909_geopolitics_04",
    "date": "2026-09-09",
    "axis": "geopolitics",
    "headline": "루비오 국무장관, 콜롬비아 안보협력·베네수엘라 마약단체·관세협상·쿠바 제재 언급",
    "facts": [
      "국무장관 마르코 루비오는 2026년 9월 8일 RCN/NTN24와 화상 인터뷰를 진행했으며 9월 9일 공개됨",
      "루비오는 ELN과 FARC 지도부가 베네수엘라 영토에서 10~15년간 공개적으로 활동하고 있다고 언급함",
      "콜롬비아의 마약대응 인증(certification)은 매년 갱신되며, 조기 발급을 위한 waiver 절차가 존재한다고 언급함",
      "콜롬비아산 제품에 대한 관세 관련 미국-콜롬비아 양자협상이 진행 중이며 현재까지 2차례 라운드가 진행됨",
      "루비오는 미국 대법원 판결로 인해 관세 부과 방식이 Section 302 절차로 변경되었다고 언급함",
      "니카라과 관련 개인에 대한 제재를 부과했다고 언급함",
      "쿠바 군수기업 GAESA를 겨냥해 미국-쿠바 관계 역사상 가장 강력한 제재를 부과했다고 언급함",
      "콜롬비아 내 미군기지 설치 가능성에 대해 콜롬비아 정부의 공식 요청이 있어야 한다고 언급함"
    ],
    "cheon_view": {
      "stance": "관망",
      "note": "",
      "status": "pending",
      "triage_score": null,
      "axis_tag": null,
      "draft_judgment": null,
      "reviewed_at": null,
      "reject_reason": null
    },
    "watchlist": [
      "콜롬비아 마약대응 재인증 시점 및 waiver 발동 여부",
      "미-콜롬비아 관세 양자협정 타결 여부 및 세부 조건",
      "베네수엘라발 무장단체 대응을 둘러싼 미-베네수엘라 관계 변화",
      "쿠바 대상 추가 제재 강화 가능성"
    ],
    "keywords": [
      "콜롬비아",
      "베네수엘라",
      "관세협상",
      "쿠바 제재",
      "마약대응 인증",
      "안보협력"
    ],
    "linked_axes": [
      "commodities_energy",
      "us_investment"
    ],
    "vault_pointer": "",
    "source_url": "https://www.state.gov/releases/office-of-the-spokesperson/2026/09/secretary-of-state-marco-rubio-with-jose-manuel-of-rcn/"
  },
  {
    "id": "20260909_geopolitics_05",
    "date": "2026-09-09",
    "axis": "geopolitics",
    "headline": "미 국무장관 루비오, 콜롬비아와 핵심광물·희토류 공급 프레임워크 및 민간 원자력 협력 MOU 2건 서명",
    "facts": [
      "2026년 9월 8일 콜롬비아 바랑키야에서 마르코 루비오 미 국무장관과 콜롬비아 아벨라르도 데 라 에스프리에야 대통령, 오마르 불라 에스코바르 외교장관이 참석한 가운데 서명식 진행",
      "첫 번째 MOU: 미국-콜롬비아 정부 간 핵심광물 및 희토류 채굴·가공 공급망 확보 프레임워크(Framework for Securing of Supply in the Mining and Processing of Critical Minerals and Rare Earths)",
      "두 번째 MOU: 미국-콜롬비아 정부 간 전략적 민간 원자력 협력 양해각서(Memorandum of Understanding Concerning Strategic Civil Nuclear Cooperation)",
      "콜롬비아 대통령은 8월 10일 지진 피해와 관련해 미국 정부가 인도적 지원으로 2,650만 달러를 지원했다고 언급",
      "콜롬비아 측은 '바랑키야 협정(Barranquilla agreements)'을 제시하며 재건, 경제 회복, 반구 안보 보호 3대 의제 제시",
      "콜롬비아는 '21세기 애국자 계획(Patriot Plan 21st century)'을 통해 항공기, 드론, 레이더, 헬기, 대드론체계 등 안보역량 현대화를 제안했다고 밝힘",
      "콜롬비아 대통령은 메데인에 '아메리카의 방패(Shield of Americas)' 거점 운영을 언급"
    ],
    "cheon_view": {
      "stance": "관망",
      "note": "",
      "status": "pending",
      "triage_score": null,
      "axis_tag": null,
      "draft_judgment": null,
      "reviewed_at": null,
      "reject_reason": null
    },
    "watchlist": [
      "콜롬비아 핵심광물·희토류 공급망 프레임워크의 구체적 이행 조건 및 투자 규모 미확정",
      "베네수엘라 관련 국경·안보 공조 확대가 지역 긴장에 미칠 영향",
      "콜롬비아 마약 대응 강화(연간 쿼터, 검증지표) 합의의 세부 이행 여부"
    ],
    "keywords": [
      "콜롬비아",
      "핵심광물",
      "희토류",
      "민간원자력협력",
      "안보협력",
      "베네수엘라"
    ],
    "linked_axes": [
      "commodities_energy",
      "us_investment"
    ],
    "vault_pointer": "",
    "source_url": "https://www.state.gov/releases/office-of-the-spokesperson/2026/09/strategic-civil-nuclear-cooperation-and-critical-minerals-framework-memorandums-of-understanding-signing-ceremony/"
  },
  {
    "id": "20260909_geopolitics_06",
    "date": "2026-09-09",
    "axis": "geopolitics",
    "headline": "미 국무장관, 타지키스탄 독립 35주년 축하 및 B5+1 포럼 협력 강조",
    "facts": [
      "마르코 루비오 미 국무장관이 2026년 9월 8일 언론성명을 발표함",
      "타지키스탄은 2026년 9월 9일 독립 35주년을 맞음",
      "성명에서 미국과 타지키스탄의 국경안보 및 대테러 협력이 언급됨",
      "타지키스탄이 두샨베에서 B5+1 포럼을 주최하며 지역 경제협력 및 무역·투자 확대 기회로 제시됨"
    ],
    "cheon_view": {
      "stance": "관망",
      "note": "",
      "status": "pending",
      "triage_score": null,
      "axis_tag": null,
      "draft_judgment": null,
      "reviewed_at": null,
      "reject_reason": null
    },
    "watchlist": [
      "중앙아시아 내 미-중, 미-러 영향력 경쟁 심화 가능성",
      "B5+1 포럼을 통한 미국 기업의 중앙아시아 투자 확대 여부"
    ],
    "keywords": [
      "타지키스탄",
      "중앙아시아",
      "국무부",
      "B5+1",
      "국경안보",
      "경제협력"
    ],
    "linked_axes": [
      "us_investment"
    ],
    "vault_pointer": "",
    "source_url": "https://www.state.gov/releases/office-of-the-spokesperson/2026/09/tajikistan-independence-day-2/"
  }
]