[
  {
    "id": "20261008_commodities_energy_01",
    "date": "2026-10-07",
    "axis": "commodities_energy",
    "headline": "2026년 겨울 에너지 지출 전망: 연료별·지역별 양극화 심화",
    "facts": [
      "천연가스와 프로판 가격 하락으로 미국 가구의 약 50%가 난방비 감소 예상 (EIA, 2026-10-07)",
      "전기와 난방유 가격 상승으로 해당 연료 사용 가구의 지출 증가 전망 (EIA, 2026-10-07)",
      "겨울 에너지 지출 변동이 지역별 기온 예측과 연료별 가격 추세 이중성에서 비롯 (EIA, 2026-10-07)"
    ],
    "keywords": [
      "천연가스 가격",
      "전기료 상승",
      "난방유",
      "겨울 에너지 지출",
      "지역별 온도 변동",
      "프로판"
    ],
    "linked_axes": [
      "rates_fx",
      "fed_policy"
    ],
    "watchlist": [
      "지역별 기온 편차 심화 시 저소득층 에너지 빈곤 위험",
      "전기·난방유 가격 급등 시 인플레이션 재점화 가능성",
      "에너지원별 공급 차질에 따른 예측 변수 변동"
    ],
    "source_url": "https://www.eia.gov/todayinenergy/detail.php?id=68264"
  }
]